{
  "$schema": "https://json-schema.org/draft/2020-12/schema",
  "title": "Claude OS Master Manifest",
  "type": "object",
  "required": ["schemaVersion", "manifests", "entrypoints", "managedProjectArtifacts", "validationPolicy"],
  "properties": {
    "schemaVersion": { "type": "integer", "minimum": 1 },
    "description": { "type": "string", "minLength": 1 },
    "manifests": {
      "type": "object",
      "required": ["bootstrap", "docs", "capabilities", "workflow"],
      "properties": {
        "bootstrap": { "type": "string", "minLength": 1 },
        "docs": { "type": "string", "minLength": 1 },
        "capabilities": { "type": "string", "minLength": 1 },
        "workflow": { "type": "string", "minLength": 1 },
        "runtimeProfiles": { "type": "string", "minLength": 1, "description": "runtime-profiles.json path" },
        "sessionMemory": { "type": "string", "minLength": 1, "description": "session-memory-manifest.json path" },
        "gitRecoveryPolicy": { "type": "string", "minLength": 1, "description": "Human Git recovery policy (markdown)" }
      },
      "additionalProperties": { "type": "string", "minLength": 1 }
    },
    "entrypoints": {
      "type": "object",
      "required": ["health", "doctor", "validateAll", "updateProject"],
      "additionalProperties": { "type": "string", "minLength": 1 }
    },
    "managedProjectArtifacts": {
      "type": "array",
      "minItems": 1,
      "items": { "type": "string", "pattern": "^\\.claude/" },
      "uniqueItems": true
    },
    "validationPolicy": { "type": "object" }
  }
}
